{
	"id": "01a0889d-847c-7e2e-9bb7-6fcc9d121745",
	"slug": "cardio",
	"title": "Разогрев",
	"rules": [],
	"excluded": [],
	"zones": [
		{
			"id": "01a0889d-847d-7d1b-a71d-1c4dfdf9c6b4",
			"slug": "cardio",
			"title": "Сердце, сосуды, лёгкие",
			"contours": [
				{
					"id": "01a0889d-847e-74da-a20c-17eb5b5c4350",
					"slug": "cardio",
					"title": "кардио",
					"exercises": [
						{
							"id": "01a0889d-8480-7d66-9472-7697e421694e",
							"slug": "c_elliptical",
							"name": "Эллипс",
							"dose": "5 мин",
							"mode": "cardio",
							"constraints": {
								"axial": false,
								"lumbar_flex": false,
								"lumbar_ext": false,
								"free_weight": false
							},
							"seconds": 300,
							"met": 5,
							"equipment": [
								{
									"id": "01a0889d-8481-7431-824d-e653e493dd0c",
									"role": "main"
								}
							],
							"targets": [
								{
									"id": "01a0889d-3844-747f-9d29-f00cdb24e1b0",
									"role": "primary"
								}
							],
							"procedure": {
								"id": "01a0889d-84b8-78c6-a30b-33a4e75fc804",
								"steps": [
									{
										"id": "01a0889d-8482-7d61-8bba-7eb3b93be682",
										"title": "Настроить эллипс",
										"active": [],
										"oracles": [
											{
												"id": "01a0889d-8483-7356-be94-ad1f16af3af5",
												"predicate": "Снаряд выставлен на разминочный уровень",
												"model": [
													"педали неподвижны",
													"счётчик времени обнулён",
													"взгляд направлен на консоль",
													"корпус вертикален у рамы",
													"гребни таза смотрят к тренажёру",
													"ладони лежат на неподвижных рукоятях",
													"колени смотрят вперёд"
												],
												"counterModel": [
													"покрытие пола скользкое"
												]
											},
											{
												"id": "01a0889d-8485-7dc2-83a5-aef6b6acffc5",
												"predicate": "Снаряд выставлен на разминочный уровень при настройке",
												"model": [
													"выбран ручной режим",
													"сопротивление на нижнем уровне"
												],
												"counterModel": [
													"вес тела переносится на рукояти"
												]
											}
										]
									},
									{
										"id": "01a0889d-8487-7933-a522-2eeed70f46b1",
										"title": "Занять положение на тренажёре",
										"active": [],
										"oracles": [
											{
												"id": "01a0889d-8488-756d-a7db-ff5270917189",
												"predicate": "Стопы целиком на педалях",
												"model": [
													"стопы стоят на педалях целиком",
													"кисти держат подвижные рукояти",
													"гребни таза смотрят вперёд"
												],
												"counterModel": [
													"вес корпуса лежит на рукоятях"
												]
											},
											{
												"id": "01a0889d-848a-73cd-b51a-fe507dc9d109",
												"predicate": "Поясница удерживает нейтраль",
												"model": [
													"корпус вертикален",
													"поясница нейтральна"
												],
												"counterModel": [
													"жжение в пояснице"
												]
											},
											{
												"id": "01a0889d-848c-72db-9e75-da5338ddcc57",
												"predicate": "Взгляд удерживает горизонт",
												"model": [
													"взгляд направлен вперёд"
												],
												"counterModel": [
													"подбородок выдвинут вперёд"
												]
											},
											{
												"id": "01a0889d-848e-7ff5-94a5-d2b1019f6234",
												"predicate": "Плечи остаются опущенными",
												"model": [
													"плечи опущены"
												],
												"counterModel": [
													"вес тела переносится на рукояти"
												]
											}
										]
									},
									{
										"id": "01a0889d-8490-78ed-bc7b-2cb6a5fe2c46",
										"title": "Разогнать шаг до разговорного темпа",
										"active": [
											"01a0889d-3844-747f-9d29-f00cdb24e1b0"
										],
										"oracles": [
											{
												"id": "01a0889d-8491-78bb-aa88-54994ce3e620",
												"predicate": "Движение доходит до разговорного темпа",
												"model": [
													"руки движутся в такт ногам",
													"взгляд направлен вперёд",
													"гребни таза смотрят вперёд"
												],
												"counterModel": [
													"боль в своде стопы",
													"корпус подпрыгивает вверх"
												]
											},
											{
												"id": "01a0889d-8494-7513-a18b-becd6e05e366",
												"predicate": "Поясница удерживает нейтраль при разгоне",
												"model": [
													"поясница нейтральна"
												],
												"counterModel": [
													"пальцы разгибаются в стороны"
												]
											},
											{
												"id": "01a0889d-8496-7aa1-b561-fe7cc2afc839",
												"predicate": "Постановка стопы остаётся одинаковой",
												"model": [
													"шаг педалей плавный",
													"стопы прижаты к педалям"
												],
												"counterModel": [
													"стук педали о раму",
													"покалывание в стопе"
												]
											},
											{
												"id": "01a0889d-8499-7026-a3f6-a75c7fe24d73",
												"predicate": "Дыхание позволяет говорить фразами",
												"model": [
													"темп нарастает постепенно"
												],
												"counterModel": [
													"покалывание в пальцах стопы"
												]
											}
										]
									},
									{
										"id": "01a0889d-849b-773c-9b15-6ae174b80c20",
										"title": "Удерживать темп 5 минут",
										"active": [
											"01a0889d-3844-747f-9d29-f00cdb24e1b0"
										],
										"oracles": [
											{
												"id": "01a0889d-849c-76bd-a0ab-96b97fd75e38",
												"predicate": "Темп неизменен 5 минут",
												"model": [
													"каденс ровный",
													"взгляд направлен вперёд",
													"гребни таза смотрят вперёд",
													"кисти лежат на подвижных рукоятях"
												],
												"counterModel": [
													"вес переносится на рукояти",
													"жжение в предплечье",
													"амплитуда сокращается к концу подхода",
													"жжение при вдохе"
												]
											},
											{
												"id": "01a0889d-84a1-7c3c-82a4-1ad4902cbf5f",
												"predicate": "Поясница удерживает нейтраль при удержании",
												"model": [
													"корпус вертикален",
													"поясница нейтральна"
												],
												"counterModel": [
													"жжение в пояснице"
												]
											},
											{
												"id": "01a0889d-84a3-7668-9ab1-a71cf45bd71a",
												"predicate": "Дыхание идёт без задержек",
												"model": [
													"дыхание ровное"
												],
												"counterModel": [
													"подбородок выдвигается вперёд"
												]
											},
											{
												"id": "01a0889d-84a5-7fc9-88f0-446698006333",
												"predicate": "Колени идут вдоль линии стоп",
												"model": [
													"колени идут вдоль стоп"
												],
												"counterModel": [
													"покалывание в стопе"
												]
											}
										]
									},
									{
										"id": "01a0889d-84a7-75c4-aa28-36a190f19dcd",
										"title": "Замедлить шаг до остановки",
										"active": [],
										"oracles": [
											{
												"id": "01a0889d-84a8-76fd-aae1-3d2772a2b99e",
												"predicate": "Педали неподвижны",
												"model": [
													"стопы стоят на педалях",
													"взгляд направлен вперёд",
													"гребни таза смотрят вперёд",
													"кисти лежат на подвижных рукоятях"
												],
												"counterModel": [
													"пульс бьёт в ушах",
													"вес тела переносится на рукояти"
												]
											},
											{
												"id": "01a0889d-84ab-700c-bc14-9f31e9b6c631",
												"predicate": "Движение доходит до остановки",
												"model": [
													"сопротивление на нижнем уровне"
												],
												"counterModel": [
													"подбородок выдвигается вперёд"
												]
											},
											{
												"id": "01a0889d-84ad-7fb1-9285-9f5c02f0a468",
												"predicate": "Ось корпуса сохраняет вертикаль",
												"model": [
													"корпус вертикален"
												],
												"counterModel": [
													"к концу подхода подбородок выдвигается вперёд"
												]
											},
											{
												"id": "01a0889d-84af-732c-9599-853fb108a3a6",
												"predicate": "Темп остаётся ровным",
												"model": [
													"темп снижается плавно",
													"дыхание восстанавливается"
												],
												"counterModel": [
													"жжение в шее"
												]
											}
										]
									},
									{
										"id": "01a0889d-84b1-744e-9574-99d2fe04ed23",
										"title": "Сойти с тренажёра",
										"active": [],
										"oracles": [
											{
												"id": "01a0889d-84b2-7baa-9b0d-56a3391b1606",
												"predicate": "Обе стопы на полу",
												"model": [
													"руки держатся за неподвижную опору",
													"стопа опускается на пол целиком",
													"взгляд направлен вперёд",
													"гребни таза смотрят вперёд"
												],
												"counterModel": [
													"стук педали о раму"
												]
											},
											{
												"id": "01a0889d-84b4-74b1-9ab1-9832be11821c",
												"predicate": "Поясница удерживает нейтраль при сходе",
												"model": [
													"корпус вертикален",
													"поясница нейтральна"
												],
												"counterModel": [
													"сход спиной вперёд",
													"головокружение при сходе"
												]
											}
										]
									}
								]
							},
							"source": "01a0889d-84b7-7275-ab95-37e42c0035c0"
						},
						{
							"id": "01a0889d-84b9-7181-b1e2-b2f7c39d2325",
							"slug": "c_bike",
							"name": "Велотренажёр вертикальный",
							"dose": "5.5 мин",